,ASL,ASL Sentence,English,English Sentence
247,NN1 IN1 NN2 CC1 NN3 NN4,i from antigua and barbuda i,PRP VB IN1 NN2 CC1 NN3 .,I be from antigua and barbuda .
248,NN1 IN1 NN2 NN3 NN4,i from burkina faso i,PRP VB IN1 NN2 NN3 .,I be from burkina faso .
249,NN1 IN1 JJ1 JJ2 NN2 NN3,i from central african republic i,PRP VB IN1 DT JJ1 JJ2 NN2 .,I be from the central african republic .
250,NN1 IN1 JJ1 NN2 NN3,i from czech republic i,PRP VB IN1 DT JJ1 NN2 .,I be from the czech republic .
251,NN1 IN1 JJ1 NN2 NNS1,i from equatorial guinea i,PRP VB IN1 JJ1 NN2 .,I be from equatorial guinea .
252,NN1 IN1 NN2 NNS1,i from guinea i,PRP VB IN1 NN2 .,I be from guinea .
253,NN1 IN1 NNS1 NNS2,i from honduras i,PRP VB IN1 NN .,I be from hondura .
254,NN1 IN1 NNS1 VBP1,i from maldives i,PRP VB IN1 DT NN .,I be from the maldive .
255,NN1 IN1 JJ1 NNS1 VBP1,i from marshall islands i,PRP VB IN1 DT JJ1 NN .,I be from the marshall island .
256,NN1 IN1 JJ1 NN2,i from nepal i,PRP VB IN1 JJ1 .,I be from nepal .
257,NN1 IN1 NNS1 JJ1,i from netherlands i,PRP VB IN1 DT NNS1 .,I be from the netherlands .
258,NN1 IN1 JJ1 JJ2 NN2 NNS1,i from papua new guinea i,PRP VB IN1 JJ1 JJ2 NN2 .,I be from papua new guinea .
259,NN1 IN1 NN2 NNS1 CC1 NN3 NN4,i from saint kitts and nevis i,PRP VB IN1 NN2 NNS1 CC1 NN3 .,I be from saint kitts and nevis .
260,NN1 IN1 NN2 NN3 CC1 DT1 NNS1 NN4,i from saint vincent and the grenadines i,PRP VB IN1 NN2 NN3 CC1 DT1 NN .,I be from saint vincent and the grenadine .
261,NN1 IN1 JJ1 NN2 CC1 NN3 NN4,i from sao tome and principe i,PRP VB IN1 JJ1 NN2 CC1 NN3 .,I be from sao tome and principe .
262,NN1 IN1 JJ1 NN2 VBZ1 NNS1,i from united arab emirates i,PRP VB IN1 DT JJ1 NN2 NN .,I be from the united arab emirate .
263,PRP$1 NN1 .1,your name ?,WP VB PRP$1 NN1 .1,what be your name ?
264,PRP1 VBP1 PRP2,I student I,PRP2 VB VBP1,I be student
